{
  "kind": "tabledossier.suggested_rules",
  "schema_version": "1.0",
  "run_id": "20261011T061539Z-33cac9b8",
  "profiled_at": "2026-10-11T06:15:39.617Z",
  "notice": "Proposals derived from observed data. They are not applied and require review by a data owner before being adopted as quality rules.",
  "rules": [
    {
      "rule_id": "sr_d84a4387985b",
      "table": "analytics.customers",
      "column": "customer_id",
      "rule_type": "not_null",
      "parameters": {},
      "status": "proposed",
      "requires_review": true,
      "rationale": "No nulls observed in the analysed scope although the column is declared nullable.",
      "evidence": [
        {
          "metric": "null_count",
          "value": 0
        },
        {
          "metric": "non_null_count",
          "value": 500
        }
      ]
    },
    {
      "rule_id": "sr_ddc3a681f407",
      "table": "analytics.customers",
      "column": "customer_id",
      "rule_type": "unique",
      "parameters": {},
      "status": "proposed",
      "requires_review": true,
      "rationale": "Approximate distinct count close to non-null count; confirm with an exact uniqueness check (deep.uniqueness) before adopting.",
      "evidence": [
        {
          "metric": "approx_distinct_count",
          "value": 499
        },
        {
          "metric": "non_null_count",
          "value": 500
        },
        {
          "metric": "null_ratio",
          "value": 0.0
        }
      ]
    },
    {
      "rule_id": "sr_70e59ef06ed0",
      "table": "analytics.customers",
      "column": "email",
      "rule_type": "matches_format",
      "parameters": {
        "format": "email_candidate"
      },
      "status": "proposed",
      "requires_review": true,
      "rationale": "Sampled values consistently match this format.",
      "evidence": [
        {
          "observed_format": "email_candidate",
          "eligible_observations": 453
        }
      ]
    },
    {
      "rule_id": "sr_880628acbde4",
      "table": "analytics.customers",
      "column": "segment",
      "rule_type": "not_null",
      "parameters": {},
      "status": "proposed",
      "requires_review": true,
      "rationale": "No nulls observed in the analysed scope although the column is declared nullable.",
      "evidence": [
        {
          "metric": "null_count",
          "value": 0
        },
        {
          "metric": "non_null_count",
          "value": 500
        }
      ]
    },
    {
      "rule_id": "sr_3792c08335a7",
      "table": "analytics.customers",
      "column": "segment",
      "rule_type": "accepted_values",
      "parameters": {
        "values": null
      },
      "status": "proposed",
      "requires_review": true,
      "rationale": "Few distinct values observed; the accepted set must be defined by a data owner (observed values are not exposed by default).",
      "evidence": [
        {
          "metric": "approx_distinct_count",
          "value": 3
        },
        {
          "metric": "non_null_count",
          "value": 500
        }
      ]
    },
    {
      "rule_id": "sr_eb72159a97c4",
      "table": "analytics.customers",
      "column": "signup_date",
      "rule_type": "not_null",
      "parameters": {},
      "status": "proposed",
      "requires_review": true,
      "rationale": "No nulls observed in the analysed scope although the column is declared nullable.",
      "evidence": [
        {
          "metric": "null_count",
          "value": 0
        },
        {
          "metric": "non_null_count",
          "value": 500
        }
      ]
    },
    {
      "rule_id": "sr_0801b020c5ae",
      "table": "analytics.customers",
      "column": "is_active",
      "rule_type": "not_null",
      "parameters": {},
      "status": "proposed",
      "requires_review": true,
      "rationale": "No nulls observed in the analysed scope although the column is declared nullable.",
      "evidence": [
        {
          "metric": "null_count",
          "value": 0
        },
        {
          "metric": "non_null_count",
          "value": 500
        }
      ]
    },
    {
      "rule_id": "sr_4e2010c46643",
      "table": "analytics.customers",
      "column": "currency",
      "rule_type": "not_null",
      "parameters": {},
      "status": "proposed",
      "requires_review": true,
      "rationale": "No nulls observed in the analysed scope although the column is declared nullable.",
      "evidence": [
        {
          "metric": "null_count",
          "value": 0
        },
        {
          "metric": "non_null_count",
          "value": 500
        }
      ]
    },
    {
      "rule_id": "sr_b8f3d5cb8290",
      "table": "analytics.customers",
      "column": "lifetime_value",
      "rule_type": "not_null",
      "parameters": {},
      "status": "proposed",
      "requires_review": true,
      "rationale": "No nulls observed in the analysed scope although the column is declared nullable.",
      "evidence": [
        {
          "metric": "null_count",
          "value": 0
        },
        {
          "metric": "non_null_count",
          "value": 500
        }
      ]
    },
    {
      "rule_id": "sr_9b8b0e3e8ba4",
      "table": "analytics.customers",
      "column": "`display name`",
      "rule_type": "not_null",
      "parameters": {},
      "status": "proposed",
      "requires_review": true,
      "rationale": "No nulls observed in the analysed scope although the column is declared nullable.",
      "evidence": [
        {
          "metric": "null_count",
          "value": 0
        },
        {
          "metric": "non_null_count",
          "value": 500
        }
      ]
    },
    {
      "rule_id": "sr_985a4926e89a",
      "table": "analytics.customers",
      "column": "`display name`",
      "rule_type": "unique",
      "parameters": {},
      "status": "proposed",
      "requires_review": true,
      "rationale": "Approximate distinct count close to non-null count; confirm with an exact uniqueness check (deep.uniqueness) before adopting.",
      "evidence": [
        {
          "metric": "approx_distinct_count",
          "value": 507
        },
        {
          "metric": "non_null_count",
          "value": 500
        },
        {
          "metric": "null_ratio",
          "value": 0.0
        }
      ]
    },
    {
      "rule_id": "sr_7017885a98dc",
      "table": "analytics.customers",
      "column": "`a.b`",
      "rule_type": "not_null",
      "parameters": {},
      "status": "proposed",
      "requires_review": true,
      "rationale": "No nulls observed in the analysed scope although the column is declared nullable.",
      "evidence": [
        {
          "metric": "null_count",
          "value": 0
        },
        {
          "metric": "non_null_count",
          "value": 500
        }
      ]
    },
    {
      "rule_id": "sr_5d03b9a28b35",
      "table": "analytics.customers",
      "column": "`a.b`",
      "rule_type": "accepted_values",
      "parameters": {
        "values": null
      },
      "status": "proposed",
      "requires_review": true,
      "rationale": "Few distinct values observed; the accepted set must be defined by a data owner (observed values are not exposed by default).",
      "evidence": [
        {
          "metric": "approx_distinct_count",
          "value": 2
        },
        {
          "metric": "non_null_count",
          "value": 500
        }
      ]
    },
    {
      "rule_id": "sr_dff5463bb123",
      "table": "analytics.orders",
      "column": "order_id",
      "rule_type": "not_null",
      "parameters": {},
      "status": "proposed",
      "requires_review": true,
      "rationale": "No nulls observed in the analysed scope although the column is declared nullable.",
      "evidence": [
        {
          "metric": "null_count",
          "value": 0
        },
        {
          "metric": "non_null_count",
          "value": 1000
        }
      ]
    },
    {
      "rule_id": "sr_1c12573d4793",
      "table": "analytics.orders",
      "column": "order_id",
      "rule_type": "unique",
      "parameters": {},
      "status": "proposed",
      "requires_review": true,
      "rationale": "Approximate distinct count close to non-null count; confirm with an exact uniqueness check (deep.uniqueness) before adopting.",
      "evidence": [
        {
          "metric": "approx_distinct_count",
          "value": 1011
        },
        {
          "metric": "non_null_count",
          "value": 1000
        },
        {
          "metric": "null_ratio",
          "value": 0.0
        },
        {
          "observed_format": "uuid"
        }
      ]
    },
    {
      "rule_id": "sr_12825296d619",
      "table": "analytics.orders",
      "column": "order_id",
      "rule_type": "matches_format",
      "parameters": {
        "format": "uuid"
      },
      "status": "proposed",
      "requires_review": true,
      "rationale": "Sampled values consistently match this format.",
      "evidence": [
        {
          "observed_format": "uuid",
          "eligible_observations": 1000
        }
      ]
    },
    {
      "rule_id": "sr_8887bac17ff0",
      "table": "analytics.orders",
      "column": "customer_id",
      "rule_type": "not_null",
      "parameters": {},
      "status": "proposed",
      "requires_review": true,
      "rationale": "No nulls observed in the analysed scope although the column is declared nullable.",
      "evidence": [
        {
          "metric": "null_count",
          "value": 0
        },
        {
          "metric": "non_null_count",
          "value": 1000
        }
      ]
    },
    {
      "rule_id": "sr_68205be84be1",
      "table": "analytics.orders",
      "column": "order_ts",
      "rule_type": "not_null",
      "parameters": {},
      "status": "proposed",
      "requires_review": true,